{
  "schema_version": 1,
  "distribution": "development-governance-v0",
  "version": "1.1.0",
  "source_repository": "mayf3/agent-development-governance",
  "source_commit": "0595e7e8a5f5bcd45660ca19fdabe932637af2ec",
  "distribution_manifest_sha256": "f5b362597b938cc94ff210c1abe1ca200f3443363e993d2aeaec1b1c07e8af69",
  "adoption": {
    "mode": "vendored",
    "status": "proposed",
    "prepared_by": "mayf3-night-agent",
    "prepared_at": "2026-09-19T09:16:09Z",
    "accepted_by": null,
    "accepted_at": null
  },
  "files": [
    {
      "path": ".agents/README.md",
      "sha256": "1f9f00a3692ac8a191384feb768f8accb4276039b688828c7db22c50efd02d22",
      "size": 15432
    },
    {
      "path": ".agents/protocol/SPEC_GOVERNANCE_V0.md",
      "sha256": "4f6deb623ccd38336d1ae5313fcb1f1bbccd41c175e1474f390d643ed12ca41b",
      "size": 930
    },
    {
      "path": ".agents/protocol/SPEC_GOVERNANCE_V1.md",
      "sha256": "0c6c6394c304a9690111ec4e0790d79ea2d9f9008b0c4bcc872b7aa069b4ee95",
      "size": 12715
    },
    {
      "path": ".agents/protocol/SPEC_FORMAT_V0.md",
      "sha256": "027b7600e240d33602e3e75ece381e82d097fdf3d5aa6f907fe46ccfff249ec4",
      "size": 13245
    },
    {
      "path": ".agents/skills/spec-governance/SKILL.md",
      "sha256": "a26f27a6f37a40984d8f80be0eea67bcf99d5055b96d840a3116a58e9603be4f",
      "size": 2589
    },
    {
      "path": ".agents/skills/spec-governance/modes/PREFLIGHT.md",
      "sha256": "9e49fb3161958adc127dff0e28c8075f4eb8345ad64163551c7f5221500be9af",
      "size": 5412
    },
    {
      "path": ".agents/skills/spec-governance/modes/AUTHOR.md",
      "sha256": "317b28afb24b4dd657671215de705bf9f631842c38b1add60c7847ff4d986327",
      "size": 2495
    },
    {
      "path": ".agents/skills/spec-governance/modes/REVIEW.md",
      "sha256": "d88dde81a444a07e31164fc5ff722ada1edc37d4ff9fe3714d56eb6deac6b9c6",
      "size": 4922
    },
    {
      "path": ".agents/skills/spec-governance/modes/COMPLIANCE.md",
      "sha256": "1f26b23f69fef5a1fce219bbc10f23770b5e34a9c026bf05b5abea4bc934881d",
      "size": 2626
    },
    {
      "path": ".agents/tools/verify_governance.py",
      "sha256": "1a4b8e3421ad6e3d07d0c11badbc103e9a7646a25015814241a3f29049515937",
      "size": 7938
    },
    {
      "path": ".agents/tools/validate_spec_transition.py",
      "sha256": "1f34e8fe1a52464a60893b4ef7ca1493aa14cac836fb1e940ec7a3c80859ce6a",
      "size": 15168
    },
    {
      "path": ".agents/tools/validate_governance_route.py",
      "sha256": "6efec5be27547c093aeb188643bd82c58ee1fbccbf91b898388d6dbd45d9d3f7",
      "size": 22467
    },
    {
      "path": ".agents/schemas/distribution-manifest.schema.json",
      "sha256": "9255c0772bf552b6118b664cd3e7a399b5ccbe6f7bedb711a9049f9716072041",
      "size": 1113
    },
    {
      "path": ".agents/schemas/spec-frontmatter.schema.json",
      "sha256": "ba481245cb9a636423f6e6386807f408f81f546553e63fd248c75a3093ece74a",
      "size": 3945
    },
    {
      "path": ".agents/schemas/governance-lock.schema.json",
      "sha256": "e21a9b535cfacc20b898e782dbe142c76078f73a76c1bcddae83ea50c0c478a3",
      "size": 2812
    },
    {
      "path": ".agents/schemas/governance-route.schema.json",
      "sha256": "b73e9d20e602a1071a0d2d56345c0fa672d4e7e7a2f84256726769ca8d9c4579",
      "size": 10530
    },
    {
      "path": ".agents/templates/SPEC_TEMPLATE.md",
      "sha256": "fbc45e2996065f3ad9db266d7bf8fad6b0adc3866bbacc6a0e32df9104e5c1e2",
      "size": 3343
    },
    {
      "path": ".agents/templates/GOVERNANCE_ADOPTION_SPEC_TEMPLATE.md",
      "sha256": "c669aa53d0cee0e87cb6cb9b835acaf2f49c7227a80279cd8da56dbbec6d7578",
      "size": 11645
    },
    {
      "path": ".agents/templates/CHANGE_BRIEF_TEMPLATE.md",
      "sha256": "612be85b23774996bb3a79430b1aa89f2e44638316ae935b1c54994c853f2a57",
      "size": 2188
    },
    {
      "path": ".agents/templates/EXEC_PLAN_TEMPLATE.md",
      "sha256": "edb7252b7416b57a8abea5ce3022d56872e849b5437f1e302c155d8183196196",
      "size": 1034
    },
    {
      "path": ".agents/templates/EXECUTION_MANDATE_TEMPLATE.md",
      "sha256": "dedeb24b0f7e53fa962693155a014da4777c8183cc16ff1e9cb138ff9fc62748",
      "size": 1682
    },
    {
      "path": ".agents/templates/CONTROLLED_RUNBOOK_TEMPLATE.md",
      "sha256": "4e36d81de5233f834fc745b917111e08f67e132fbb2a78dcdeb82ec9701a9d9b",
      "size": 1498
    },
    {
      "path": ".agents/templates/REVIEW_RECORD_TEMPLATE.md",
      "sha256": "d716b53aa216b3ab2a966a5090f4dc92a18a59a1b792008568d15890d46b4d4f",
      "size": 2649
    },
    {
      "path": ".agents/templates/CONFORMANCE_RECORD_TEMPLATE.md",
      "sha256": "bfc491210cf0754b818a48290a3ce07639ac0f301e3c891c3eea4fc0a4b0dbdd",
      "size": 1848
    },
    {
      "path": ".agents/templates/INVESTIGATION_RECORD_TEMPLATE.md",
      "sha256": "e63e5081b1fb68720784bf6bc6bd35357901d8ed566743a7e1507b5a9c5ca28b",
      "size": 1394
    }
  ]
}
